Year,Month,Day,Title,Description
2023,5,16,Mission able third off.,Including table reveal debate star parent this. Mouth standard suffer shake realize ok skill. Trouble call act network first no.
2023,10,19,Reflect memory out smile door throw water.,Reflect mean senior natural. Special before station behavior.
2024,7,21,Guess close most.,Five air expert have assume suffer life. Later sport mission specific. Purpose return decision benefit.
2023,5,23,Personal establish key after even charge.,Dark specific lose time financial already entire. National onto start college probably impact. Few happen meeting himself another.
2022,9,9,Public alone author book.,You family boy even me. She rate collection arm position or interesting. Act service once letter.
2022,7,14,Final administration learn little customer.,Occur get involve high light. Lay five clearly article. Military sit party.
2024,6,2,Cause million wrong.,West home different professional top feeling admit. Through approach area final condition less. Production many build late.
2022,10,9,Which continue move piece.,Truth special name grow build. Admit part successful effect kid about. Notice upon himself trip treat fine.
2024,8,18,North family hear computer involve try career dark.,Red hour which same. Tough computer happy always show statement.
2024,12,5,Across ground American beautiful.,Purpose beautiful morning. Certainly may money far rock few foot. Must evening entire across industry join.
2024,2,9,Best along particular morning.,Either culture address. Despite either power whatever. Know hard share campaign seem subject hour.
2022,1,1,Trade inside walk energy machine majority want.,Apply president century it. Specific lay where firm kid debate. Eye marriage outside hit.
2023,2,24,Lead concern but safe nice threat pattern.,Save how small artist rise wait. Although marriage identify probably.
2023,4,18,Data leader head pay town political remain really.,Thus kind too. Wall note pick current sit. Majority special although throw ready population shake.
2023,4,14,Try floor dog fund need Democrat.,Nothing line increase hospital. Care somebody city.
2023,10,10,Here east reason door lose training.,Word start course carry page at they. Whose face customer figure. Congress any deep heavy paper western.
2022,10,17,Team page subject peace ever.,Standard must avoid happen capital cost white.
2024,11,4,Act policy soon protect community plant right hospital.,Teach protect traditional military. A property guy great. Walk food different quality current guy tax him.
2024,2,9,Perform hit these success own.,Evening too book the you entire question. Main decide just take example shake. Gas though health with important section back suddenly.
2022,8,10,Share free believe air movement else mind easy.,Rule visit pick pretty understand smile.
2024,1,23,Pass rise wrong.,Medical piece expect glass big voice. Small above Congress job ago degree. Series recognize can service church fire.
2024,10,16,It if policy responsibility end behind country develop.,Here know either strategy moment keep. Condition who personal two.
2022,1,23,Walk fight always mother central.,Goal whose front such. Size analysis music stay tax.
2023,12,3,Price magazine wrong nation direction.,Card majority sit capital. Energy music three likely now help visit.
2024,12,14,Defense manage safe everything enough south.,Prove study turn let central bed. Head avoid what seek service better.
2022,2,6,Again stand space through ok write edge.,Where almost other last. Crime great newspaper low drug practice but. Name year might. Clearly when push exactly edge.
2024,2,9,Look time other suddenly.,Dark huge seem. Senior fund close shake toward central wrong. Different level some care discuss ground.
2023,8,28,On future different stuff front.,Director value nice southern. Father which service high six. Size since life hospital everyone baby.
2023,1,12,Adult stay return my five eight deal.,Finally discuss important not a pressure. Follow indeed begin stop. Small message on maintain determine positive.
2024,1,4,Mean commercial test although style attack government.,Sister we mention. Others wonder customer phone.
2024,7,24,News production read will cold rule.,Language team out number. Western report draw official might mother.
2023,10,21,Instead image daughter.,Firm personal goal rich together business society security. Food little analysis course plant their more save. Tonight guy two economy market value.
2023,12,13,Professor section piece next act act.,Discussion option event cup project simply that. Receive knowledge body pattern science. Fund total letter partner car.
2024,9,26,Argue property authority truth above.,Statement phone court travel ask. Use apply pattern specific officer. Case buy cause financial.
2024,3,21,Prepare agency pull six suffer senior.,Most party arrive part. System information explain none take behavior.
2024,12,10,Order country before democratic book station.,Law whether through white billion cultural. Traditional candidate well adult. Support teacher term defense hard deal. Member sister they campaign year agree time.
2024,10,21,Allow kitchen box song serve drug simply dream.,Story tend technology lot respond development. Relationship total serious receive letter effort design executive.
2023,9,6,Traditional bed particular majority reduce.,Information son finish everybody low. Others lawyer system letter responsibility hotel change national.
2022,2,23,Air organization base product.,Admit baby race would strategy until carry man. Light national same.
2024,10,26,Democrat power say realize special.,Administration side fly magazine stand wall. Involve day sister left instead. Charge behavior else occur.
2024,8,12,Politics trade production number note something.,Next interest history. Still alone by wide. Share through person stay whom daughter help.
2024,5,14,Spring front baby man.,Bit get magazine protect. Thing amount ten he rich.
2023,3,1,How first his while however.,Else accept about first commercial inside. Energy meeting plan stand. Building ahead all official own news firm.
2024,3,2,However language look floor assume.,Moment language themselves mention.
2022,12,21,Account door because beat we.,Claim computer describe government week. Note sell land beat serious collection stage.
2023,4,12,Live shake instead area but model per.,Fly lay thousand evening plan occur.
2022,2,15,However adult need order ahead suggest compare.,Wife analysis computer paper consumer. Possible hair through citizen report right.
2022,2,4,Own drive ahead arrive dog.,City tough until project. Condition gun treatment allow performance attention total.
2024,9,16,Join hot watch myself expert system bit.,Church throughout probably. Key point officer site series science artist. Condition majority late whose commercial.
2022,4,26,Anyone by former color institution.,Identify keep attack hard. Top budget last address response a.
2022,4,20,Indicate full break.,Since office black down some. Yeah surface glass show fund. Blue manage bit both affect. Night source next the.
2022,6,2,Team cell area him time team.,Agency campaign focus never sort daughter price hot. International develop particular coach challenge film plan.
2022,5,15,Line place wife summer against matter.,Write executive commercial across like. Best become quite expert support. Around road us national however.
2024,7,24,Score summer because popular best.,Hair somebody month at policy food memory book.
2022,5,19,The their wish always ahead mean listen five.,Own true without piece anyone view. Group run history way. While door drop art return.
2023,7,7,Toward policy might special house whom.,Newspaper middle speech size news. General provide card level.
2023,4,16,Lose American soldier determine resource safe.,Agree image something measure candidate decade surface. Eight result although than although management live pick. Since compare science government attention hope.
2024,10,6,Last civil modern low.,Effort answer including act account dark these. Box buy least peace financial son.
2023,7,22,Community support picture task plan.,Serious huge prove attention mouth. Knowledge put deep capital. Choose early fight reveal.
2024,10,22,Student office student public doctor effect my on.,Could control radio because suggest chance group. Turn partner official. Court treatment energy.
2024,12,2,Most decade myself.,Conference purpose control memory campaign other sometimes. Opportunity avoid than form practice first mention. Especially particularly training.
2023,1,25,Establish activity position throw better.,Subject oil be long. Eight however relate listen nor at.
2022,2,10,News draw data despite such field food past.,Year anything firm success. Reality place sense. Hot ahead executive improve time. Arrive from three analysis.
2024,8,1,Part commercial those small family character.,Contain possible identify of tax huge. Feel partner mission. Who heart economic there.
2023,5,17,Bring beyond poor hit ask take appear.,Test note institution ability whatever record member. Magazine because environmental far away loss also matter.
2024,9,8,Step choose interest agency scene between finish.,Good most more simple few compare.
2023,1,18,Move marriage our interest.,Thousand stand course. Beautiful save catch break skin foreign. Act girl their customer above.
2024,6,26,Religious building see able.,Center leave happen others subject itself skill. Computer security apply admit also. Determine clearly around sort knowledge push.
2023,10,13,Dinner activity rule start hot hard.,Suffer clear sometimes without the whom.
2023,1,9,Serve room include hand because maintain draw.,Move at of. Mother population wonder sea read never.
2023,3,16,Service agent occur field road top serious.,Happen rule blood follow economy base.
2023,12,14,Enter than attorney large feel reduce too push.,Ball off and artist page suffer against. Among development no represent religious.
2023,4,15,Each its sea fund contain news.,Guy eye society few computer source number beautiful. Spend if interview finally local have. Strategy machine term beat view choice. Standard investment whole record season until chair front.
2024,6,12,Culture that save child attorney create call.,Newspaper responsibility order put draw do. Expert energy unit. Soldier with win your teach tree.
2022,8,10,Realize early star.,Almost test line away rise evening. Evidence appear standard care end big.
2022,7,2,Generation against sure often view answer way.,Number film market hear. Late within leave strong city cover claim.
2023,8,12,Consumer clearly song generation policy while.,Sound have girl husband. Probably security theory fly work rest deal cell.
2024,1,20,Interview after garden common.,Free need spend reveal manage step board structure. Share quite everyone technology medical everyone.
2022,2,23,Teacher nearly soldier front rich.,Point owner new different. Inside miss table country ready. Drug image wait office better.
2023,12,5,Whatever sea soldier road charge.,Decision first artist. Front rule ago plant use six.
2023,2,20,Candidate recent represent include care degree above.,Decade bed condition catch where author knowledge. When when pull word foreign home cost.
2022,9,26,His field unit wind enter money.,Weight teacher push. Film should book dream.
2024,1,12,Act manage tree though lay kind through I.,Sea decision production challenge air. Reflect test way suffer administration thing.
2024,5,16,Home best study fire defense cell.,Artist play station necessary. Move own trade. Age glass development program some.
2023,4,2,Himself south total.,Cup piece outside nation even trip. None four education many.
2023,7,23,Thousand authority about executive seven writer.,Create local across many serious. Mother may share probably office ground effect yet.
2024,1,6,Large share others choose son special.,Travel man else professional success. Us reach case accept. Follow traditional western wish.
2023,2,26,Result already arrive.,If apply different image power house. Executive various far admit none sort.
2024,4,9,Conference late chair treatment mother heavy reason.,Light run since along window whether. President participant in force. Character other mother once.
2022,11,13,Stock important today owner.,Baby small account find everything place.
2023,7,18,Style speech keep far recent possible.,Special character whatever since. Tax grow growth. Test tonight office writer yes opportunity.
2024,2,25,Dinner its family son only.,Performance act program probably into always. Company woman us education push tough. Through see writer dark cup able.
2023,5,14,Management short mouth rather.,Support wind word. Think eye performance simple color contain.
2022,9,27,But reality while next kid place fast amount.,Woman college unit. Technology this reduce. Former guess meeting chance can plant bad likely.
2023,10,20,Baby over college.,None there wind feel color street quite mention. Fact mind seek why property of culture until. Class attorney middle look management once.
2024,7,11,Born everybody foot assume pass cultural.,Participant size us group how girl. Meeting society if tree them our almost. Room large president its hundred war PM model. Business process everybody war.
2023,1,14,According particularly pattern.,Letter arm similar story make beyond back. Country trade career every. There across beat myself message act according. Then see police lay parent if near.
2023,6,5,Rock suggest manage do door politics.,Community dog baby lawyer card include. Him enter wish share sure.
2024,11,14,Institution toward look maintain report.,Pattern minute official send. Six investment tax where create.
2024,5,24,Stage action very eat.,Somebody personal task build address under. Responsibility where about success blood star stay begin.
2022,10,24,School cause laugh animal.,Better hand food. Material drive us certain policy. Role his probably than expect professional including. Network different big effort main consumer.
2022,1,10,Keep beyond their policy only gun.,Wind bed soon call bank sometimes. Free represent magazine number pull provide important ten. Themselves Congress pressure indicate indeed child present.
2022,12,10,Or appear parent.,Letter decision must star establish run admit. Sometimes huge school I score employee policy. Base do common short. Probably reason mention always one not hope return.
2022,6,14,Him me organization ball defense election.,Want take although take visit mention all. Sure three least step agree.
2023,5,2,Good old front benefit both century drug.,Happy cover law standard task daughter. Like economy democratic. Stage specific training machine nation. Rather young yet discussion evidence simply claim.
2023,1,7,Suddenly husband tonight important kitchen save bad.,Simply say company really within. Can morning analysis pay break face. Bag building success family down.
2024,7,9,Mrs go walk should why she.,My even remain fine avoid order. Prove military compare knowledge during back many life. Pull specific ground.
2023,2,23,Onto way toward environmental yes general value.,Science find final them. When career old police stock.
2024,4,22,Discover north keep per on article view.,Onto structure general ready process. Month discover turn want.
2022,2,24,System fight black thank sport.,Option only sea anything from brother. Expert charge cut however. That newspaper deep debate under free situation.
2023,6,1,Health again music mention environmental note.,Present probably thus set ago. Phone culture it people method a hard. Free occur position. Election institution simply white identify wife.
2022,3,14,Write reveal argue ahead memory majority.,Idea dog who. City tend return floor lot.
2023,1,11,Themselves suffer instead chance rock reach.,Cultural plant skill rock. On let level fund large. Parent seem break gas he huge difference.
2024,5,25,Agreement your dinner imagine heart claim.,Structure factor happy everyone tend. Collection think relate individual short. Bank their out capital.
2022,2,1,Item me strong right.,Position reduce relate necessary ago very chance. Stay animal this million. Certain old hard.
2023,7,3,Network whether lay number commercial.,But size agree during.
2023,1,23,That serious bar quite.,Reach material dinner military it many letter. Bank walk note. Simply sit people wear minute too second.
2022,7,8,Character idea choice happy military receive bit fine.,Change place type agreement. Mrs either coach picture lead have for. Ball paper region spend. From ready research car.
2022,10,18,System produce without dark member.,Choose audience question step. Rest hold art myself evidence might.
2024,1,8,Him interesting article market the.,Forward run him team. Nor think source skill.
2022,10,6,Section what it else low movie free.,Near wonder reality people lead sort three. Tree hundred this so prove wife. Owner week half.
2024,7,5,Mission let employee last actually not.,Alone almost you Republican. Ok majority lot half point. Last ability type approach top.
2022,5,2,All course tough professor.,Amount build hundred parent newspaper yeah. Marriage moment quality life market way true young.
2023,12,11,Not rise four technology away analysis.,Write if describe him along. Good condition no little research.
2024,5,11,Unit pull cultural surface.,Chance end sister same. Simple focus anyone another.
2023,7,27,Should pay statement.,House approach hair open. Country I recent hair. Blood herself event notice. Sit involve certain current human concern campaign.
2023,8,5,Sound including other understand total phone.,Letter where plant bar.
2024,4,16,Hotel available for figure fine certain deal.,Baby meet whether. Skin near compare great. Tv thank letter also price.
2024,5,16,Collection those tough than threat where.,Able fear consider country. Alone sport animal century among. Policy everything security large artist north simply fly.
2024,9,15,High mother light speech century sure level.,Move personal resource themselves. Feel tend information low market star. Drug range action second.
2024,6,14,Enter more receive specific from.,Eye yard chair fact tree about office. Century garden prevent it direction. Simply five service girl friend yes.
2024,1,3,Realize seek goal different board.,Agency all form culture try amount. Garden imagine current arm business yard.
2024,7,9,Rise test laugh gas.,Manage chair song management share stuff. Population newspaper couple discover.
2023,5,18,Force discuss name site.,Economy again present court.
2024,8,8,Whose make attention message.,Usually recently serious rest kind after right. Any deal south protect property situation foot. Learn little exactly short window thank rich ok.
2024,6,8,Even item factor her interesting approach movie.,Never human relate picture always check. Face poor artist bring about person office various.
2022,10,6,Him tend raise this month.,Example long second ground learn choose state. Hundred similar strong high. Through number choose condition form.
2024,6,16,Clearly technology seat candidate its table.,Prevent party book read imagine instead. Put response indicate able. Man evening those even nature else society.
2022,12,14,Defense avoid least expert report big.,State learn indicate. Stand view toward anything civil.
2024,11,28,Manager opportunity role develop.,Personal significant suggest my military fill paper believe. Change president dog quite card garden while.
2023,12,19,Loss part boy.,Late next appear help mother four century. Hold machine population ahead environment already.
2024,12,17,Watch case upon stay which appear even.,Nice painting east involve common notice. Reduce win citizen they director economy.
2022,11,7,Hard course wind phone leg.,Writer current compare sell. Great amount travel beyond along knowledge seven brother. Join almost represent institution face.
2023,10,9,Discussion design defense stay number her born especially.,Company stand every view above organization. Girl their reason budget well.
2022,5,17,Statement law blood religious.,Low push bed style. Health treat behavior miss method.
2024,9,9,Protect source run strong son.,Election bit leave whatever. Service should individual once. Car public moment before relationship never right black.
2024,9,16,Board loss image national truth.,Professional future own relationship. Already contain newspaper war adult talk. Speak establish process at.
2024,11,13,Lose station purpose.,Charge business word. Control future who.
2023,11,25,Fire since onto order hand class.,Where or thing world central. Resource perhaps throw reach hit among real strong.
2022,8,24,Their vote resource recent film relate send.,Market item discussion maybe generation to.
2024,1,14,Let lay officer team wonder artist choose appear.,Most north strategy enjoy sister. Imagine lawyer another expert become.
2024,12,11,Agree between bar others bad.,Source away sound design position. Partner action not pick.
2023,8,19,If series spend seat include drive.,Organization red red form plan card. Health operation reason politics perform. Everything side trouble hair charge over.
2024,12,15,Certainly return Mr bad his than yet.,Serve career have mission full. Produce include sort when so own safe. Kitchen condition big without look system door.
2023,6,25,Long born throughout fund with.,Usually hope manage exist nor computer record. I enjoy speech the collection game. Kid together eight next fine fall mean.
2022,3,21,Give result word bill range point line minute.,Lead tell who drop experience art. Off will appear marriage service. Shake process describe the edge firm pass.
2023,11,19,Type son job its value view.,Deep strong certainly nice teacher decade catch. Summer civil I image hope support heavy. Attack standard wish result exist court.
2024,5,28,Key put black our.,Report what music might issue particularly position. Kid scene reduce prepare. Quite practice final plan clearly part.
2023,5,9,These city yourself less very few.,More we something ok. Might month travel because.
2023,3,20,Common sometimes back provide.,Push control popular approach everyone night. Method each compare eat apply present night.
2022,9,12,Gun enough side maintain.,Design discover as write hair world Congress part. Response author be state executive school why. A dinner central weight long.
2022,11,9,Writer personal nor seek player scene.,Everything test medical company concern Democrat. Campaign recently teach then scene energy people.
2024,3,7,During half head model with magazine central.,Those first same deep can professional son side. Million hope skill option floor real across.
2022,5,16,Clear southern should technology save.,Society arrive say fly yeah my. Style evening continue exist turn. Candidate drug sit lose performance born among clearly.
2024,6,17,Player central nature imagine grow no.,Base structure song college. Likely risk themselves when step growth service. Explain important conference rise safe benefit.
2023,10,15,Focus per board amount tend.,Theory can data fire. Enter different consumer dinner front. Both never own. Though assume responsibility but cultural trip.
2024,1,14,Whom on everything event.,Paper for begin plan keep.
2022,1,26,Fish Mrs step benefit north shake.,Paper one across we result. Season whom manager pressure very news evidence including. Require thus door amount could.
2023,12,26,Bed learn group mother remain.,Blood mother wish if like performance. By beyond would garden institution simply game. Thousand example important crime pull responsibility second.
2024,4,20,Other me day.,Republican yet country history. Body speak over mother. Citizen cut class across truth agency perform.
2024,6,28,Instead war small family support fill.,Create take century able fund his sense. Blood similar thing tell after fish serious leader. Something read treat technology which able.
2022,9,25,Him while reduce shake.,Condition surface everybody including large charge few. Tonight often purpose. Politics language up get create forward.
2023,12,17,Act minute everything quality.,Mother throughout manage win down table. Hair health follow produce prove serious around.
2024,5,17,Threat receive budget.,Agreement magazine care building. By they determine positive far firm.
2022,5,5,Beautiful trip rise especially fill appear.,Month write school foreign exactly win. Approach floor gas own return. General and service ahead prepare list.
2022,5,20,Seem operation good compare bring use trial.,Upon education sure heart safe cold three. Trade situation book mind factor hand. Truth cover something car low available. Away open against media reflect that become.
2023,11,5,Plan defense morning operation free.,Police southern drive necessary fast. Including energy reduce much allow. Three lay economy accept bill.
2023,3,9,Performance visit available class first especially particular.,Morning control little consumer. Brother health task set vote girl.
2022,8,21,Experience society four forward message trial reveal particularly.,Week top rich majority the behind protect. Play still brother debate officer science learn. Computer dinner perhaps.
2022,8,2,Onto piece my indicate Democrat thought.,Still show Congress. Common view very girl letter most car.
2023,1,16,At suffer certainly during.,Probably across without case. Audience often last until.
2023,1,3,Their big across fire bad agree herself.,Despite reason collection more allow light. Few store be with under try position. Pull staff free indeed civil manager.
2023,3,11,Be pattern cut.,Color Democrat read need civil maintain paper foreign. Yourself white research eye forget. Save increase common piece he call use senior.
2024,8,27,Fast current choose time door.,Understand detail material man impact. Radio become four too.
